{
  "schema_version": "schema_v1",
  "run_id": "run_2026_04_22_full_method_v1_eval_full_001",
  "system_id": "full_method_v1",
  "instance_id": "arrays_binary_search_002",
  "provider_metadata": {
    "name": "openai",
    "model": "gpt-5.4-nano",
    "model_version": "gpt-5.4-nano-2026-03-17",
    "latency_ms": 4666,
    "prompt_tokens": 1197,
    "completion_tokens": 577
  },
  "raw_output_path": "generated/full_method_v1/raw/arrays_binary_search_002.txt",
  "parse_status": {
    "ok": true
  },
  "normalized_obligations": [
    {
      "kind": "precondition",
      "lean_statement": "theorem SU1_sorted_precond {a : Arr} (h : Sorted a) : Sorted a := h",
      "nl_gloss": "Assume the input slice is sorted in nondecreasing order (SortedLE).",
      "linked_semantic_units": [
        "SU1"
      ],
      "confidence": 0.55
    },
    {
      "kind": "unknown",
      "lean_statement": "theorem SU2_some_implies_inbounds_and_eq {a : Arr} {t : Int} {i : Nat}\n  (h : binarySearch a t = some i) : IndexValid i a ∧ nthLe a i = t := by\n  -- proof obligation: model must guarantee bounds and equality when Some i is returned\n  admit",
      "nl_gloss": "If the algorithm returns Some i, then i is a valid index and a[i] = target.",
      "linked_semantic_units": [
        "SU2"
      ],
      "confidence": 0.7
    },
    {
      "kind": "unknown",
      "lean_statement": "theorem SU3_none_implies_absent {a : Arr} {t : Int}\n  (h : binarySearch a t = none) : ¬ ∃ i : Nat, IndexValid i a ∧ nthLe a i = t := by\n  -- proof obligation: model must guarantee absence when None is returned\n  admit",
      "nl_gloss": "If the algorithm returns None, then target does not occur at any valid index.",
      "linked_semantic_units": [
        "SU3"
      ],
      "confidence": 0.7
    },
    {
      "kind": "termination",
      "lean_statement": "theorem SU4_terminates {a : Arr} {t : Int} : ∃ n : Nat, True := by\n  -- proof obligation placeholder: establish termination via a variant/measure\n  exact ⟨0, trivial⟩",
      "nl_gloss": "The function terminates on every input (loop variant decreases).",
      "linked_semantic_units": [
        "SU4"
      ],
      "confidence": 0.2
    },
    {
      "kind": "unknown",
      "lean_statement": "theorem SU5_duplicates_allow_any_index {a : Arr} {t : Int} {i j : Nat}\n  (hi : binarySearch a t = some i)\n  (hj : binarySearch a t = some j)\n  (hiv : IndexValid i a)\n  (hjv : IndexValid j a) : nthLe a i = t ∧ nthLe a j = t := by\n  -- proof obligation: if multiple indices match, returning any valid one is acceptable\n  admit",
      "nl_gloss": "When duplicates exist, returning any matching valid index is allowed; both returned indices (if Some) must satisfy equality.",
      "linked_semantic_units": [
        "SU5",
        "SU2"
      ],
      "confidence": 0.55
    }
  ],
  "prompt_hash": "sha256:3799cdd428c5b801e17327a93043f492a663b027ca983ec95488eacb63a712e7",
  "seed": 1
}