{
  "schema_version": "schema_v1",
  "run_id": "run_2026_04_22_text_only_v1_eval_003",
  "system_id": "text_only_v1",
  "instance_id": "greedy_interval_scheduling_001",
  "provider_metadata": {
    "name": "openai",
    "model": "gpt-5.4-nano",
    "model_version": "gpt-5.4-nano-2026-03-17",
    "latency_ms": 8272,
    "prompt_tokens": 150,
    "completion_tokens": 953
  },
  "raw_output_path": "generated/text_only_v1/raw/greedy_interval_scheduling_001.txt",
  "parse_status": {
    "ok": true
  },
  "normalized_obligations": [
    {
      "kind": "unknown",
      "lean_statement": "def Interval (α : Type) := { start : α // True }",
      "nl_gloss": "Introduce an interval type (placeholder) to model closed-open intervals.",
      "linked_semantic_units": []
    },
    {
      "kind": "unknown",
      "lean_statement": "structure COpenInterval (α : Type) where\n  start : α\n  end_ : α\n  (h : start ≤ end_)",
      "nl_gloss": "Define a closed-open interval [start, end) with the invariant start ≤ end.",
      "linked_semantic_units": []
    },
    {
      "kind": "unknown",
      "lean_statement": "def nonoverlap {α} [LinearOrder α] (I J : COpenInterval α) : Prop := I.end_ ≤ J.start ∨ J.end_ ≤ I.start",
      "nl_gloss": "Define when two intervals are mutually non-overlapping (disjoint in closed-open sense).",
      "linked_semantic_units": []
    },
    {
      "kind": "unknown",
      "lean_statement": "def pairwiseNonoverlap {α} [LinearOrder α] (s : List (COpenInterval α)) : Prop :=\n  ∀ ⦃I⦄, I ∈ s → ∀ ⦃J⦄, J ∈ s → I ≠ J → nonoverlap I J",
      "nl_gloss": "Define pairwise non-overlap for a set/list of intervals.",
      "linked_semantic_units": []
    },
    {
      "kind": "unknown",
      "lean_statement": "def selectable {α} [LinearOrder α] (s : List (COpenInterval α)) : Prop := pairwiseNonoverlap s",
      "nl_gloss": "Define that a selection is valid iff its intervals are pairwise non-overlapping.",
      "linked_semantic_units": []
    },
    {
      "kind": "unknown",
      "lean_statement": "def maxSelectable {α} [LinearOrder α] (xs : List (COpenInterval α)) : Nat :=\n  Nat.findGreatest (by\n    -- placeholder: existence of a maximum size among finite subsets\n    admit) (by\n    -- placeholder: monotonicity\n    admit)",
      "nl_gloss": "Define the intended objective: the maximum size of a selectable subset.",
      "linked_semantic_units": []
    },
    {
      "kind": "unknown",
      "lean_statement": "theorem maxSelectable_spec {α} [LinearOrder α] (xs : List (COpenInterval α)) :\n  (∃ s : List (COpenInterval α), s ⊆ xs ∧ selectable s ∧ s.length = maxSelectable xs) ∧\n  (∀ t : List (COpenInterval α), t ⊆ xs → selectable t → t.length ≤ maxSelectable xs)",
      "nl_gloss": "The returned maximum is achievable by some selectable subset, and no selectable subset is larger.",
      "linked_semantic_units": []
    },
    {
      "kind": "unknown",
      "lean_statement": "def solve {α} [LinearOrder α] (xs : List (COpenInterval α)) : Nat := maxSelectable xs",
      "nl_gloss": "Define the algorithm result as the maximum selectable size (spec-level definition).",
      "linked_semantic_units": []
    },
    {
      "kind": "unknown",
      "lean_statement": "theorem solve_correct {α} [LinearOrder α] (xs : List (COpenInterval α)) :\n  (∃ s : List (COpenInterval α), s ⊆ xs ∧ selectable s ∧ s.length = solve xs) ∧\n  (∀ t : List (COpenInterval α), t ⊆ xs → selectable t → t.length ≤ solve xs)",
      "nl_gloss": "The solver returns exactly the maximum number of mutually non-overlapping intervals.",
      "linked_semantic_units": []
    },
    {
      "kind": "unknown",
      "lean_statement": "theorem solve_nil {α} [LinearOrder α] : solve ([] : List (COpenInterval α)) = 0",
      "nl_gloss": "With no intervals, the maximum selectable number is 0.",
      "linked_semantic_units": []
    },
    {
      "kind": "unknown",
      "lean_statement": "theorem solve_single {α} [LinearOrder α] (I : COpenInterval α) : solve [I] = 1",
      "nl_gloss": "With one interval, the maximum selectable number is 1.",
      "linked_semantic_units": []
    }
  ],
  "prompt_hash": "sha256:e80a1a82f665d25dd080fd56daf39cb9dc3df38275d9c2e9a2853ffdf3125e4a",
  "seed": 3
}