{
  "schema_version": "schema_v1",
  "run_id": "run_2026_04_22_text_only_v1_eval_003",
  "system_id": "text_only_v1",
  "instance_id": "dp_longest_common_subsequence_001",
  "provider_metadata": {
    "name": "openai",
    "model": "gpt-5.4-nano",
    "model_version": "gpt-5.4-nano-2026-03-17",
    "latency_ms": 6282,
    "prompt_tokens": 163,
    "completion_tokens": 794
  },
  "raw_output_path": "generated/text_only_v1/raw/dp_longest_common_subsequence_001.txt",
  "parse_status": {
    "ok": true
  },
  "normalized_obligations": [
    {
      "kind": "unknown",
      "lean_statement": "def lcsLen (a b : List Int) : Nat := sorry",
      "nl_gloss": "Define the function that returns the length of the longest common subsequence between lists a and b.",
      "linked_semantic_units": []
    },
    {
      "kind": "unknown",
      "lean_statement": "def IsSubseq (s t : List Int) : Prop := ∃ (pref suf : List Int), t = pref ++ s ++ suf ∧ True",
      "nl_gloss": "Provide a predicate capturing that s is a subsequence of t (not necessarily contiguous) in the same relative order.",
      "linked_semantic_units": []
    },
    {
      "kind": "unknown",
      "lean_statement": "∀ s t : List Int, IsSubseq s t ↔ (∃ f : Fin s.length → Fin t.length, (∀ i, f i < t.length) ∧ (∀ i j, i < j → f i < f j) ∧ (∀ i, s.nthLe i (by simp) = t.nthLe (f i) (by simp)))",
      "nl_gloss": "Characterize subsequence by an order-preserving index embedding from s into t.",
      "linked_semantic_units": []
    },
    {
      "kind": "unknown",
      "lean_statement": "∀ s : List Int, IsSubseq s a → IsSubseq s b → s.length ≤ lcsLen a b",
      "nl_gloss": "Any common subsequence s of a and b has length at most the returned value.",
      "linked_semantic_units": []
    },
    {
      "kind": "unknown",
      "lean_statement": "∃ s : List Int, IsSubseq s a ∧ IsSubseq s b ∧ s.length = lcsLen a b",
      "nl_gloss": "There exists a common subsequence whose length equals the returned value.",
      "linked_semantic_units": []
    },
    {
      "kind": "unknown",
      "lean_statement": "∀ n : Nat, (∃ s : List Int, IsSubseq s a ∧ IsSubseq s b ∧ s.length = n) → n ≤ lcsLen a b",
      "nl_gloss": "The returned length is the maximum length among all common subsequences.",
      "linked_semantic_units": []
    },
    {
      "kind": "unknown",
      "lean_statement": "lcsLen [] b = 0 ∧ lcsLen a [] = 0",
      "nl_gloss": "If either input list is empty, the longest common subsequence length is 0.",
      "linked_semantic_units": []
    },
    {
      "kind": "unknown",
      "lean_statement": "∀ a b : List Int, ∀ x y : Int, a = aInit ++ [x] → b = bInit ++ [y] → x = y → lcsLen a b = lcsLen aInit bInit + 1",
      "nl_gloss": "If the last elements of both lists are equal, the optimal length increases by 1 over the prefixes.",
      "linked_semantic_units": []
    },
    {
      "kind": "unknown",
      "lean_statement": "∀ a b : List Int, ∀ x y : Int, a = aInit ++ [x] → b = bInit ++ [y] → x ≠ y → lcsLen a b = Nat.max (lcsLen aInit b) (lcsLen a bInit)",
      "nl_gloss": "If the last elements differ, the optimal length is the maximum of dropping one last element from either list.",
      "linked_semantic_units": []
    }
  ],
  "prompt_hash": "sha256:115732557df9858e4adc937e0aac028d24c28180b83f55a56468f8ec0bdc6d4c",
  "seed": 3
}