{
  "schema_version": "schema_v1",
  "run_id": "run_2026_04_22_text_only_v1_eval_003",
  "system_id": "text_only_v1",
  "instance_id": "arrays_max_subarray_001",
  "provider_metadata": {
    "name": "openai",
    "model": "gpt-5.4-nano",
    "model_version": "gpt-5.4-nano-2026-03-17",
    "latency_ms": 8492,
    "prompt_tokens": 143,
    "completion_tokens": 1130
  },
  "raw_output_path": "generated/text_only_v1/raw/arrays_max_subarray_001.txt",
  "parse_status": {
    "ok": true
  },
  "normalized_obligations": [
    {
      "kind": "unknown",
      "lean_statement": "import Std\n\nopen scoped BigOperators\n\ndef maxContigSubsliceSum (xs : Array Int) : Int :=\n  if h : xs.length = 0 then 0 else\n  let n := xs.length\n  let sums : Fin n → Int := fun i =>\n    let recSum : Nat → Int := fun len =>\n      let j : Nat := i.1 + len\n      if h' : j ≤ n then\n        (xs.extract i.1 (len)).foldl (· + ·) 0\n      else 0\n    recSum 0\n  -- placeholder; actual implementation obligations below\n  0",
      "nl_gloss": "Define the target function that returns the maximum sum over all contiguous non-empty subslices of a non-empty array of integers (with a harmless value for the empty case).",
      "linked_semantic_units": []
    },
    {
      "kind": "precondition",
      "lean_statement": "theorem maxContigSubsliceSum_spec_pre {xs : Array Int} (hxs : xs.length > 0) : True := by trivial",
      "nl_gloss": "Assume the input slice/array is non-empty (length > 0).",
      "linked_semantic_units": []
    },
    {
      "kind": "unknown",
      "lean_statement": "theorem exists_nonempty_subslice {xs : Array Int} (hxs : xs.length > 0) :\n  ∃ (i j : Nat), i < j ∧ j ≤ xs.length := by\n    refine ⟨0, 1, ?_, ?_⟩\n    · exact Nat.zero_lt_one\n    · simpa [hxs] using (Nat.succ_le_iff.2 (Nat.pos_of_ne_zero (by\n        intro h0; simpa [h0] using hxs)))",
      "nl_gloss": "For a non-empty array, there exists at least one contiguous non-empty subslice (choose i=0, j=1).",
      "linked_semantic_units": []
    },
    {
      "kind": "unknown",
      "lean_statement": "def subsliceSum (xs : Array Int) (i j : Nat) : Int :=\n  xs.extract i (j - i) |>.foldl (· + ·) 0\n\ntheorem subsliceSum_nonempty {xs : Array Int} {i j : Nat}\n    (hij : i < j) : j - i > 0 := by\n  exact Nat.sub_pos_of_lt hij",
      "nl_gloss": "Define the sum of a contiguous subslice xs[i..j) and note that if i<j then the subslice is non-empty.",
      "linked_semantic_units": []
    },
    {
      "kind": "unknown",
      "lean_statement": "theorem maxContigSubsliceSum_upper_bound {xs : Array Int} (hxs : xs.length > 0)\n    (i j : Nat) (hij : i < j ∧ j ≤ xs.length) :\n    subsliceSum xs i j ≤ maxContigSubsliceSum xs hxs := by\n  -- proof obligation: the returned value is at least every subslice sum\n  admit",
      "nl_gloss": "The returned maximum is greater than or equal to the sum of any contiguous non-empty subslice.",
      "linked_semantic_units": []
    },
    {
      "kind": "unknown",
      "lean_statement": "theorem maxContigSubsliceSum_attains {xs : Array Int} (hxs : xs.length > 0) :\n  ∃ (i j : Nat), i < j ∧ j ≤ xs.length ∧\n    maxContigSubsliceSum xs hxs = subsliceSum xs i j := by\n  -- proof obligation: the maximum is achieved by some contiguous non-empty subslice\n  admit",
      "nl_gloss": "There exists a contiguous non-empty subslice whose sum equals the returned maximum.",
      "linked_semantic_units": []
    },
    {
      "kind": "unknown",
      "lean_statement": "theorem maxContigSubsliceSum_characterization {xs : Array Int} (hxs : xs.length > 0) :\n  maxContigSubsliceSum xs hxs =\n    (Finset.univ.image (fun p : {p : Nat × Nat // p.1 < p.2 ∧ p.2 ≤ xs.length} =>\n      subsliceSum xs p.1.1 p.1.2)).sup (by\n        -- non-emptiness of the set of valid subslices\n        have : ∃ p : {p : Nat × Nat // p.1 < p.2 ∧ p.2 ≤ xs.length}, True := by\n          obtain ⟨i, j, hi_lt, hj_le⟩ := ⟨0, 1, Nat.zero_lt_one, Nat.succ_le_iff.2 (Nat.pos_of_ne_zero (by\n            intro h0; simpa [h0] using hxs)))⟩\n          refine ⟨⟨(i, j), ?_⟩, trivial⟩\n          exact ⟨hi_lt, hj_le⟩\n        simpa [Finset.nonempty_iff_ne_empty] using this) := by\n  -- proof obligation: returned value equals the supremum/maximum over all valid subslice sums\n  admit",
      "nl_gloss": "The returned value is exactly the maximum (supremum over a finite set) of the sums of all contiguous non-empty subslices.",
      "linked_semantic_units": []
    }
  ],
  "prompt_hash": "sha256:3b98846f5d91ad14aa2ad4a0495fec8c93778f589bb12e1b439c63748165a242",
  "seed": 3
}