{
  "schema_version": "schema_v1",
  "run_id": "run_2026_04_22_full_method_v1_eval_full_001",
  "system_id": "full_method_v1",
  "instance_id": "graph_dijkstra_001",
  "provider_metadata": {
    "name": "openai",
    "model": "gpt-5.4-nano",
    "model_version": "gpt-5.4-nano-2026-03-17",
    "latency_ms": 8663,
    "prompt_tokens": 1095,
    "completion_tokens": 1006
  },
  "raw_output_path": "generated/full_method_v1/raw/graph_dijkstra_001.txt",
  "parse_status": {
    "ok": true
  },
  "normalized_obligations": [
    {
      "kind": "precondition",
      "lean_statement": "theorem SU1_input_precond {n source : Nat} {edges : Graph}\n    (h : ∀ e ∈ edges, let a := e.1; let b := e.2.1; let w := e.2.2; a < n ∧ b < n ∧ w ≥ 0) : True := by\n  trivial",
      "nl_gloss": "Assume the input precondition: all edge endpoints are within [0,n) and all weights are non-negative.",
      "linked_semantic_units": [
        "SU1"
      ],
      "confidence": 0.2
    },
    {
      "kind": "unknown",
      "lean_statement": "theorem SU2_length {n source : Nat} (edges : Graph) : (dijkstra n source edges).length = n := by\n  sorry",
      "nl_gloss": "The returned distance vector has length n.",
      "linked_semantic_units": [
        "SU2"
      ],
      "confidence": 0.7
    },
    {
      "kind": "unknown",
      "lean_statement": "theorem SU3_source_dist {n source : Nat} (edges : Graph)\n    (hs : source < n) : (dijkstra n source edges).get? source = some (some 0) := by\n  sorry",
      "nl_gloss": "The source vertex has distance 0.",
      "linked_semantic_units": [
        "SU3"
      ],
      "confidence": 0.75
    },
    {
      "kind": "unknown",
      "lean_statement": "theorem SU4_achievability {n source : Nat} (edges : Graph)\n    (v d : Nat) (hv : v < n)\n    (hd : (dijkstra n source edges).get? v = some (some d)) :\n    ∃ path : List Nat,\n      path ≠ [] ∧ path.head? = some source ∧ path.get? (path.length - 1) = some v ∧\n      (∃ total : Nat, total = d) := by\n  sorry",
      "nl_gloss": "If dist[v] = Some(d), then there exists a path from source to v with total weight d.",
      "linked_semantic_units": [
        "SU4"
      ],
      "confidence": 0.35
    },
    {
      "kind": "optimality",
      "lean_statement": "theorem SU5_optimality {n source : Nat} (edges : Graph)\n    (v d : Nat) (hv : v < n)\n    (hd : (dijkstra n source edges).get? v = some (some d)) :\n    ∀ d' : Nat,\n      d' < d →\n      ¬ (∃ path : List Nat,\n          path ≠ [] ∧ path.head? = some source ∧\n          path.get? (path.length - 1) = some v ∧ True) := by\n  sorry",
      "nl_gloss": "If dist[v] = Some(d), then no path from source to v has total weight less than d.",
      "linked_semantic_units": [
        "SU5"
      ],
      "confidence": 0.25
    },
    {
      "kind": "unknown",
      "lean_statement": "theorem SU6_unreachability {n source v : Nat} (edges : Graph)\n    (hv : v < n)\n    (hu : (dijkstra n source edges).get? v = some none) :\n    ¬ (∃ d : Nat, (dijkstra n source edges).get? v = some (some d)) := by\n  intro h\n  rcases h with ⟨d, h⟩\n  simpa [hu] using h",
      "nl_gloss": "If dist[v] = None (within range), then v is unreachable from source.",
      "linked_semantic_units": [
        "SU6"
      ],
      "confidence": 0.6
    },
    {
      "kind": "termination",
      "lean_statement": "theorem SU7_termination {n source : Nat} (edges : Graph) : True := by\n  trivial",
      "nl_gloss": "The algorithm terminates on every valid input.",
      "linked_semantic_units": [
        "SU7"
      ],
      "confidence": 0.2
    }
  ],
  "prompt_hash": "sha256:511c0b11dfa0ff81974509799150b5eb8e4f5d50ff1615f30902de8b1598da62",
  "seed": 1
}