{
  "schema_version": "schema_v1",
  "run_id": "run_2026_04_22_naive_concat_v1_eval_full_001",
  "system_id": "naive_concat_v1",
  "instance_id": "arrays_binary_search_001",
  "provider_metadata": {
    "name": "openai",
    "model": "gpt-5.4-nano",
    "model_version": "gpt-5.4-nano-2026-03-17",
    "latency_ms": 8435,
    "prompt_tokens": 156,
    "completion_tokens": 1161
  },
  "raw_output_path": "generated/naive_concat_v1/raw/arrays_binary_search_001.txt",
  "parse_status": {
    "ok": true
  },
  "normalized_obligations": [
    {
      "kind": "precondition",
      "lean_statement": "∀ (arr : Array Int) (target : Int), True",
      "nl_gloss": "No additional global preconditions beyond having an array and a target; the algorithm must work for any input.",
      "linked_semantic_units": []
    },
    {
      "kind": "precondition",
      "lean_statement": "∀ (arr : Array Int), SortedNondecreasing arr → True",
      "nl_gloss": "Assume the input slice/array is sorted in nondecreasing order (i.e., for all i<j, arr[i] ≤ arr[j]).",
      "linked_semantic_units": []
    },
    {
      "kind": "unknown",
      "lean_statement": "let n := arr.size; let f := fun i : Fin n => arr[i.1]; True",
      "nl_gloss": "Relate the array to an indexable function over Fin n (used to state correctness over valid indices only).",
      "linked_semantic_units": []
    },
    {
      "kind": "unknown",
      "lean_statement": "∀ (arr : Array Int) (target : Int) (res : Option (Fin arr.size)),\n  SortedNondecreasing arr →\n  (res = binarySearch arr target) →\n  (match res with\n   | some i => arr[i.1] = target\n   | none => ∀ j : Fin arr.size, arr[j.1] ≠ target)",
      "nl_gloss": "Soundness: if the implementation returns Some i, then arr[i] equals the target; if it returns None, then the target does not occur at any valid index.",
      "linked_semantic_units": []
    },
    {
      "kind": "unknown",
      "lean_statement": "∀ (arr : Array Int) (target : Int),\n  SortedNondecreasing arr →\n  (binarySearch arr target = none ↔ ∀ j : Fin arr.size, arr[j.1] ≠ target)",
      "nl_gloss": "Completeness for absence: under sortedness, the algorithm returns None exactly when the target is absent from the array.",
      "linked_semantic_units": []
    },
    {
      "kind": "unknown",
      "lean_statement": "∀ (arr : Array Int) (target : Int),\n  SortedNondecreasing arr →\n  (∃ j : Fin arr.size, arr[j.1] = target) →\n  ∃ i : Fin arr.size, binarySearch arr target = some i ∧ arr[i.1] = target",
      "nl_gloss": "Completeness for presence: under sortedness, if the target occurs somewhere, the algorithm returns Some at some valid matching index.",
      "linked_semantic_units": []
    },
    {
      "kind": "unknown",
      "lean_statement": "∀ (arr : Array Int) (target : Int),\n  SortedNondecreasing arr →\n  match binarySearch arr target with\n  | some i => i.1 < arr.size\n  | none => True",
      "nl_gloss": "Safety: any returned index is within bounds (Fin arr.size guarantees this, but the obligation makes it explicit).",
      "linked_semantic_units": []
    },
    {
      "kind": "termination",
      "lean_statement": "∀ (arr : Array Int) (target : Int),\n  SortedNondecreasing arr →\n  binarySearch terminates",
      "nl_gloss": "Termination: the implementation must always terminate (e.g., via a decreasing interval measure in the binary search loop/recursion).",
      "linked_semantic_units": []
    },
    {
      "kind": "invariant",
      "lean_statement": "∀ (arr : Array Int) (target : Int),\n  SortedNondecreasing arr →\n  ∀ (lo hi : Nat),\n    (* invariant holds at each step of the algorithm *)\n    Invariant arr target lo hi →\n    (* invariant implies the search space contains all possible matches *)\n    (∃ j : Fin arr.size, arr[j.1] = target) →\n    (∃ j : Fin arr.size, lo ≤ j.1 ∧ j.1 < hi ∧ arr[j.1] = target)",
      "nl_gloss": "Loop/recursion invariant: if the target exists anywhere, then it must lie within the current search interval (so the algorithm never discards a region that could contain the target).",
      "linked_semantic_units": []
    },
    {
      "kind": "invariant",
      "lean_statement": "∀ (arr : Array Int) (target : Int),\n  SortedNondecreasing arr →\n  ∀ (lo hi : Nat),\n    Invariant arr target lo hi →\n    lo ≤ hi ∧ hi ≤ arr.size",
      "nl_gloss": "Interval bounds invariant: the maintained search interval is always well-formed and within array bounds.",
      "linked_semantic_units": []
    },
    {
      "kind": "invariant",
      "lean_statement": "∀ (arr : Array Int) (target : Int),\n  SortedNondecreasing arr →\n  ∀ (lo hi : Nat),\n    Invariant arr target lo hi →\n    (∀ j : Fin arr.size, j.1 < lo → arr[j.1] < target) ∧\n    (∀ j : Fin arr.size, j.1 ≥ hi → arr[j.1] > target)",
      "nl_gloss": "Stronger invariant using sortedness: indices strictly left of the interval cannot contain the target (they are < target), and indices strictly right cannot contain the target (they are > target).",
      "linked_semantic_units": []
    },
    {
      "kind": "postcondition",
      "lean_statement": "∀ (arr : Array Int) (target : Int),\n  SortedNondecreasing arr →\n  let res := binarySearch arr target\n  in match res with\n     | some i => arr[i.1] = target\n     | none => ∀ j : Fin arr.size, arr[j.1] ≠ target",
      "nl_gloss": "Final postcondition: combines the two cases into a single statement matching the required return behavior.",
      "linked_semantic_units": []
    }
  ],
  "prompt_hash": "sha256:c736d3f6c4a1da20def4da464ccd550ee8133dd0b8b416aaa49054b5c4c562e5",
  "seed": 1
}